ruc,descripcion,fundador,fundacion_fecha,banner_url,nombre
54779141613,"Since throughout little behind seem. Nor front at music police.
Help cut dinner bit. Success perform my government also management.
Major capital ever decade edge art sound. Care move camera apply. Pull season just less Republican.
Interesting machine trial reality. Quickly development hand allow. Almost reflect mind.
Use seat argue value by. Occur necessary pattern. Tax morning heart necessary hand.",Lisa Frost,2013-11-20,https://dummyimage.com/866x771,Blake Well
