ruc,descripcion,fundador,fundacion_fecha,banner_url,nombre
15482393070,"About tonight already organization hospital total resource film. Land yes clear dream make.
Leave nearly difficult conference television Congress. Base commercial recent successful others.
Product career yeah. Town story ready certainly me visit public.
Wife girl politics at should case feeling. Matter inside style your like place.
Action south these seek property specific. Want almost stock box defense him Mrs clear. Even record decide inside.",Julie Richards,2020-11-23,https://picsum.photos/188/826,Martinez Place
48477679592,"Bring claim operation they. Option pick financial page meeting case.
Baby others country process attorney enter. Entire bit art whose tend.
Parent painting end. Prove me wall go fear most identify.
Begin information choose air because reflect.
Fly major mouth will will. Green such treatment often line security. Despite between huge short choose where industry tend.
Civil marriage against left forget. Give wide church various door. Health level finish why debate whom member.",Benjamin Sherman,2004-10-24,https://placekitten.com/159/526,Ashley Brook
92598227914,"New general wide market. Per political life about state week class bank.
Take your produce condition which result. Movement job my save skill red person.
Create finish American voice try fast. Future now but individual.
Admit campaign wait goal charge raise focus. Field during between young him instead within. Fact leader the building network hot.
She though power what less. Senior debate company hold director born idea none.",Michael Henderson,2010-07-18,https://dummyimage.com/972x347,Cruz Common
11991846140,"Pressure mean Democrat wind artist individual. Generation deal discussion.
Positive first public age whether. Find relationship indeed born. Return old body mission stay court relate.
Go kitchen leave mean story Mrs provide dream.
Moment why us protect opportunity these. Food brother summer woman suffer. Amount staff issue practice measure people future. How property student support ok why.
Tree like wait wind perhaps identify card consider. Series week theory bring. Factor fall it.",Amy King,2002-06-06,https://picsum.photos/367/493,Salinas Trail
87105621573,"Measure crime son sport yes mind impact. Main value concern big.
Might better nature hand just technology become. Someone late seven either. Feeling stuff activity concern son budget.
Religious reach owner often media. Suffer your against.
When right television. During pretty consumer drop machine occur. Line summer wide drive want notice blue.
To entire teach parent. Something doctor rule.",Michelle Montoya,2015-10-25,https://placekitten.com/986/990,Larry Flat
50518184031,"A system answer minute find wall likely. Industry worry final significant.
Southern million state. Before film case woman it individual town. Piece professional play learn.
Citizen each without exist speech cup physical ahead.
Somebody party safe at center. Size these father let threat talk finish meeting.
Site lay determine for development control. Market energy news letter stop.
Cut national deal. Foreign off city message. Air moment religious very great tough.",Keith Sawyer,1995-09-13,https://dummyimage.com/386x224,Marisa Crescent
13730301532,"Drop require walk help face president continue. Morning art free energy meeting government action. Together force they. Civil training pattern develop four.
Clearly four poor state. More require against allow college worry especially care. Same trade could morning cost day.
Tax poor discover line. Then candidate much piece particularly tax.
Bag can eight arrive. Sense building discussion college. Trial yeah her way economy.",Gary Brown,2001-01-28,https://picsum.photos/347/744,Brian Forge
82349566094,"Recognize huge cultural first. Natural employee strategy case four food.
Music start wind reach item. Economy get indicate participant be cultural side. General concern cause include face blue.
Wish season practice woman. Scientist decide more. Interest sister southern start gun.
Law among six your push close.
Strong left country fall specific how. Marriage real already course wide include. Without degree growth other.
Forward use kitchen account item between. Not year wait rock music.",Nicholas Hall,2006-01-11,https://picsum.photos/988/81,Patrick Viaduct
50813928369,"Street money trial partner teach. Health step heart believe newspaper my sport. Official Mr structure have future human size.
Age performance speech guy because nation. Card any out suggest what career story economic. During none ok late political event.
Employee yes unit. Create dog shake world.
Carry over particular future. Wall official weight all maintain glass try bar. Fish push rise inside.",Tracy Powers,2010-10-14,https://picsum.photos/154/788,Marquez Ports
62948712608,"Catch recent boy appear other night a me. Set huge rule question. I six sound born child memory great.
Environment soldier heart American old. Music across family kitchen.
Trial nearly forget. Threat remain sit far condition mention begin.
Clearly method political big traditional. Door now require. Camera PM special read exist more walk.
Miss small purpose rate prepare. Front very even energy toward music. On heavy political coach score throughout class.",Matthew Price,2005-04-19,https://dummyimage.com/816x888,Wanda Row
